{
  "id": "unit_flemish_pikemen",
  "name": {
    "display": "Piquiers flamands",
    "local": "goedendag-dragers",
    "local_language": "moyen néerlandais"
  },
  "category": "infantry",
  "source_class": "burghers",
  "soldiers": 120,
  "cost": {
    "money": 650
  },
  "upkeep": 60,
  "recruit_time_turns": 1,
  "stats": {
    "melee": 55,
    "ranged": 0,
    "range": 0,
    "armor": 40,
    "morale": 60,
    "speed": 40,
    "ammo": 0
  },
  "abilities": [
    "pike_square",
    "shield_wall"
  ],
  "required_culture": [
    "cul_flemish"
  ],
  "figure": "infantry_4",
  "equipment": "Pique, goedendag (bâton ferré), chapel de fer, plates de corps.",
  "description": "Milices des métiers de [[cdx_bruges|Bruges]], d’Ypres et de [[cdx_gand|Gand]] ; ont brisé la chevalerie française à Courtrai (1302) avant d’être écrasées à [[cdx_roosebeke|Roosebeke]] (1382).",
  "sources": [
    "Bataille des éperons d'or",
    "Goedendag"
  ]
}
